{
  "updated_at": "2026-07-30T17:03:36Z",
  "base_url": "https://raw.githubusercontent.com/blackaft/burnoutseries/dev/.agents/vaults/excerpts/",
  "count": 1,
  "items": [
    {
      "id": "prologue",
      "excerpt": "And on the 103rd day, his hollow gaze towards the Greek horizon, thinking how summer waves on the beach was just a fucking cliche. The sky instinctively felt blue, but its color was washed away by Chalkidiki’s unforgiving August sun. He shook his...",
      "published_at": "2026-07-24T18:26:08Z",
      "file": "prologue.md"
    }
  ]
}
