{
    "updated_at": "2026-07-25T06:15:38Z",
    "base_url": "https://raw.githubusercontent.com/blackaft/burnoutseries/dev/.agents/vaults/about/",
    "count": 1,
    "items": [
        {
            "id": "summary",
            "excerpt": "BURNOUT is an experimental series about the bullshit lies we tell ourselves, with 3 parts and 19 chapters, including videos, author’s notes and behind the scenes with George Kary. It was born out of a passion for exploring multi-disciplinary and c...",
            "published_at": "2026-07-24T18:26:08Z",
            "file": "summary.md"
        }
    ]
}