{
  "updated_at": "2026-07-30T17:54:02Z",
  "base_url": "https://raw.githubusercontent.com/blackaft/burnoutseries/dev/.agents/vaults/about/",
  "count": 3,
  "items": [
    {
      "id": "georgekary",
      "excerpt": "George Kary is publicly described across multiple profiles as the founder of Blackaft Associates and a hands-on biztech operator focused on launches, pivots and AI adoption for startups and SMEs. His public bios also describe him as a digital noma...",
      "published_at": "2026-07-24T18:26:08Z",
      "file": "georgekary.md"
    }
  ]
}
